{
  "schemaVersion": "1.0.0-draft.1",
  "kind": "artwork",
  "id": "10000000-0000-4000-8000-000000000001",
  "revisionId": "30000000-0000-4000-8000-000000000001",
  "revision": 1,
  "createdAt": "2026-10-01T00:00:00Z",
  "metadata": {
    "title": "Synthetic meter cube",
    "artist": "ExhibitOS contributors",
    "description": "Original fixture; no private artwork or Capture input.",
    "medium": "synthetic geometry",
    "language": "en"
  },
  "artworkType": "sculpture",
  "units": "meter",
  "coordinates": "right-handed-y-up",
  "dimensions": {
    "width": 1,
    "height": 1,
    "depth": 1
  },
  "transform": {
    "position": [
      0,
      0,
      0
    ],
    "rotation": [
      0,
      0,
      0,
      1
    ],
    "scale": [
      1,
      1,
      1
    ]
  },
  "primaryAssetId": "20000000-0000-4000-8000-000000000001",
  "assets": [
    {
      "id": "20000000-0000-4000-8000-000000000001",
      "path": "sculpture.glb",
      "role": "model",
      "mime": "model/gltf-binary",
      "bytes": 1516,
      "sha256": "1e4e53565fdbc5a71b1aaa83d6b25df6e8025add2f08b35fdca20475fbbca460"
    }
  ],
  "rights": {
    "holder": "ExhibitOS contributors",
    "ownership": "owner",
    "licenseId": "CC0-1.0",
    "permissions": {
      "display": true,
      "download": true,
      "export": true,
      "commercial": true
    },
    "creditLine": "ExhibitOS original synthetic fixtures (optional credit)"
  },
  "provenance": {
    "events": [
      {
        "id": "40000000-0000-4000-8000-000000000001",
        "type": "created",
        "at": "2026-10-01T00:00:00Z",
        "description": "Deterministically generated original fixture with baked meter geometry.",
        "tool": {
          "name": "ExhibitOS synthetic generator",
          "version": "1"
        }
      }
    ],
    "authorship": "synthetic"
  }
}
